URL,Version,Status,OIDs,Name,Title,Descriptino,Uses,Used,Sources
http://hl7.org/fhir/ValueSet/c80-doc-typecodes,4.0.1,active,"2.16.840.1.113883.3.88.12.80.47",DocumentTypeValueSet,Document Type Value Set,"This is the code specifying the precise type of document (e.g. Pulmonary History and  Physical, Discharge Summary, Ultrasound Report, etc.). The Document Type value set includes all LOINC  values listed in HITSP C80 Table 2-144 Document Class Value Set Definition above used for Document Class,  and all LOINC values whose SCALE is DOC in the LOINC database.","StructureDefinition/esms-document-reference","LOINC"
https://mos.esante.gouv.fr/NOS/JDV_J250-MotifStatutPersonnePriseChargeUnite/FHIR/JDV-J250-MotifStatutPersonnePriseChargeUnite,1.1.0,active,"1.2.250.1.213.3.4.114",JDV_J250-MotifStatutPersonnePriseChargeUnite,null,"Motif du statut de la personne prise en charge au sein d'une unité","StructureDefinition/sdo-task","ans.fr.nos"
https://mos.esante.gouv.fr/NOS/JDV_J251-MotifStatutPersonnePriseChargeESMS/FHIR/JDV-J251-MotifStatutPersonnePriseChargeESMS,1.1.0,active,"1.2.250.1.213.3.4.115",JDV_J251-MotifStatutPersonnePriseChargeESMS,null,"Motif du statut de la personne prise en charge au sein d'un ESMS","StructureDefinition/sdo-task","ans.fr.nos"
https://mos.esante.gouv.fr/NOS/JDV_J252-StatutPersonnePriseChargeESMS/FHIR/JDV-J252-StatutPersonnePriseChargeESMS,1.1.0,active,"1.2.250.1.213.3.4.116",JDV_J252-StatutPersonnePriseChargeESMS,null,"Statut de la personne prise en charge au sein d'un ESMS","StructureDefinition/sdo-task","ans.fr.nos"
https://mos.esante.gouv.fr/NOS/JDV_J253-StatutPersonnePriseChargeUnite/FHIR/JDV-J253-StatutPersonnePriseChargeUnite,1.1.0,active,"1.2.250.1.213.3.4.117",JDV_J253-StatutPersonnePriseChargeUnite,null,"Statut de la personne prise en charge au sein d'une unité","StructureDefinition/sdo-task","ans.fr.nos"
https://mos.esante.gouv.fr/NOS/JDV_J30-TemporaliteAccueil-ROR/FHIR/JDV-J30-TemporaliteAccueil-ROR,1.1.0,active,"1.2.250.1.213.3.3.32",JDV_J30-TemporaliteAccueil-ROR,null,"Temporalité accueil - ROR","StructureDefinition/sdo-task","ans.fr.nos"
https://mos.esante.gouv.fr/NOS/JDV_J34-CategorieOrganisation-ROR/FHIR/JDV-J34-CategorieOrganisation-ROR,1.1.0,active,"1.2.250.1.213.3.3.40",JDV_J34-CategorieOrganisation-ROR,null,"Catégorie d'organisation - ROR","StructureDefinition/sdo-task","ans.fr.nos"
